{
  "module": "pathfinder.cra",
  "version": "1.0.0",
  "claim_status": "denied",
  "evidence_presence": {
    "service_records_available": "unknown",
    "current_diagnosis_documentation_exists": "yes",
    "nexus_opinion_exists": "no",
    "lay_statements_present": "yes",
    "continuity_evidence_present": "unknown"
  },
  "administrative_context": {
    "representation_status": "none",
    "prior_va_decisions_received": "yes",
    "appeal_lane_used": "unknown"
  },
  "veteran_reported_barriers": [
    "difficulty_obtaining_records",
    "confusion_about_process"
  ],
  "meta": {
    "created_at": "2026-01-01T19:25:00Z",
    "source": "intake"
  }
}
