{
  "module": "pathfinder.cra",
  "version": "1.0.0",
  "claim_status": "unknown",
  "evidence_presence": {
    "service_records_available": "unknown",
    "current_diagnosis_documentation_exists": "unknown",
    "nexus_opinion_exists": "unknown",
    "lay_statements_present": "unknown",
    "continuity_evidence_present": "unknown"
  },
  "administrative_context": {
    "representation_status": "unknown",
    "prior_va_decisions_received": "unknown",
    "appeal_lane_used": "unknown"
  },
  "veteran_reported_barriers": [],
  "unsafe_content_detected": {
    "present": true,
    "reason_codes": [
      "diagnosis_or_condition_named",
      "free_text_medical_field_detected"
    ]
  },
  "meta": {
    "created_at": "2026-01-01T20:00:00Z",
    "source": "intake"
  }
}
